{"_meta": {"api_version": "1", "contract_version": "1.14", "generated_at": "2026-07-22T01:57:35+00:00", "provenance": "socrata", "data_tier": "mixed", "tier_note": "Headlines, links, dates, and outlet names are real (verbatim from the outlets' public RSS feeds); the entity matching (wards/aldermen/routes/projects) is derived and best-effort.", "license": "City of Chicago Data Portal Terms of Use (data.cityofchicago.org); derived analyses by On Your Left!", "attribution": "On Your Left! \u2014 Chicago bike safety, on the record (https://github.com/jartinator/chicago-safe-streets-data)", "human_page": "https://jartinator.github.io/chicago-safe-streets-data/action.html", "methodology": "https://jartinator.github.io/chicago-safe-streets-data/methodology.html", "schema": "https://jartinator.github.io/chicago-safe-streets-data/api/v1/schemas/news.schema.json"}, "as_of": "2026-07-22T01:57:05+00:00", "note": "Recent public news coverage of Chicago bike/street safety: verbatim headlines, links, dates, and outlet names from the outlets' own public RSS feeds \u2014 never article text. Matching to wards, alderpersons, and main routes is computed by exact name rules (each match records how it was made in `via`) and can miss or, rarely, mismatch; the linked article is authoritative. These are independent editorial outlets: coverage listed here is not an endorsement by this site, and absence of coverage does not mean nothing happened \u2014 outlets cover some neighborhoods more than others.", "items": [{"title": "Many locals say People for Bikes rating Chicago as tied for worst was wrong. But what *should* we do to improve cycling?", "url": "https://chi.streetsblog.org/2026/07/20/many-locals-say-people-for-bikes-rating-chicago-as-tied-for-worst-was-wrong-but-what-should-we-do-to-improve-cycling", "source": "Streetsblog Chicago", "published": "2026-07-21T01:33:02+00:00", "wards": [], "aldermen": [], "routes": [], "projects": []}, {"title": "Police: Bridgeport motorcyclist is in critical condition after New Haven crash", "url": "https://www.nhregister.com/news/article/bridgeport-man-new-haven-motorcycle-crash-22352114.php", "source": "New Haven Register", "published": "2026-07-20T17:08:38+00:00", "wards": [], "aldermen": [], "routes": [], "projects": []}, {"title": "A 35-year-old Bridgeport motorcyclist died after a New Haven crash", "url": "https://www.nhregister.com/news/article/bridgeport-man-killed-new-haven-motorcycle-crash-22352114.php", "source": "New Haven Register", "published": "2026-07-20T14:18:29+00:00", "wards": [], "aldermen": [], "routes": [], "projects": []}, {"title": "Motorcyclist injured in Grand Avenue crash, road closed", "url": "https://www.weareiowa.com/article/traffic/incidents/grand-avenue-crash-road-closed-motorcyclist-injured/524-665168bd-02f0-4d83-848e-bc756476bc88", "source": "weareiowa.com", "published": "2026-07-19T22:42:00+00:00", "wards": [], "aldermen": [], "routes": [], "projects": ["grand-avenue"]}, {"title": "Chicago delivery firms hit with bike-lane fines amid Smart Streets push", "url": "https://hoodline.com/2026/07/downtown-bike-lane-cam-crackdown-hammers-chicago-delivery-giants/", "source": "Hoodline", "published": "2026-07-19T16:59:36+00:00", "wards": [], "aldermen": [], "routes": [], "projects": []}, {"title": "Chicago bike lane ticketing program records big fines against delivery companies", "url": "https://www.chicagotribune.com/2026/07/19/bike-lane-ticketing-fines-delivery-companies/", "source": "Chicago Tribune", "published": "2026-07-19T11:00:31+00:00", "wards": [], "aldermen": [], "routes": [], "projects": []}, {"title": "The crash deaths of transportation planners Riley O\u2019Neil and Louisa Gag should be a turning point for Safe Streets", "url": "https://chi.streetsblog.org/2026/07/17/the-bike-crash-deaths-of-transportation-planners-riley-oneil-and-louisa-gag-should-be-a-turning-point-for-safe-streets", "source": "Streetsblog Chicago", "published": "2026-07-18T00:33:28+00:00", "wards": [], "aldermen": [], "routes": [], "projects": []}, {"title": "Letters: Aldermanic prerogative stands in the way of a better bike lane network in Chicago", "url": "https://www.chicagotribune.com/2026/07/08/letters-070826-bike-lanes/", "source": "Chicago Tribune", "published": "2026-07-08T07:00:00+00:00", "wards": [], "aldermen": [], "routes": [], "projects": []}, {"title": "Letters: Here\u2019s why I am opposed to segregated bike lanes in Chicago", "url": "https://www.chicagotribune.com/2026/07/07/letters-070726-bike-lanes/", "source": "Chicago Tribune", "published": "2026-07-07T07:00:00+00:00", "wards": [], "aldermen": [], "routes": [], "projects": []}, {"title": "Letters: I feel safer riding a bike in Chicago than driving a car. But bike safety is still a concern.", "url": "https://www.chicagotribune.com/2026/07/06/letters-070626-bike-lanes/", "source": "Chicago Tribune", "published": "2026-07-06T07:00:00+00:00", "wards": [], "aldermen": [], "routes": [], "projects": []}, {"title": "Letters: When it comes to bike lanes, there is no perfect solution for everyone", "url": "https://www.chicagotribune.com/2026/07/05/letters-070526-bike-lanes/", "source": "Chicago Tribune", "published": "2026-07-05T07:00:00+00:00", "wards": [], "aldermen": [], "routes": [], "projects": []}, {"title": "Letters: Chicago\u2019s approach to bike lanes has been a disaster", "url": "https://www.chicagotribune.com/2026/07/04/letters-070426-bike-lanes/", "source": "Chicago Tribune", "published": "2026-07-04T07:00:00+00:00", "wards": [], "aldermen": [], "routes": [], "projects": []}, {"title": "Santa Ana hit-and-run victim leading UC Irvine oceanographer, and Chicago shows bike lanes don't hurt local businesses", "url": "https://bikinginla.com/2026/06/24/santa-ana-hit-and-run-victim-leading-uc-irvine-oceanographer-and-chicago-shows-bike-lanes-dont-hurt-local-businesses/", "source": "BikinginLA", "published": "2026-06-24T07:00:00+00:00", "wards": [], "aldermen": [], "routes": [], "projects": []}, {"title": "Chicago\u2019s Bike Lanes Don\u2019t Hurt Businesses, City Report Finds", "url": "https://blockclubchicago.org/2026/06/23/chicagos-bike-lanes-dont-hurt-businesses-city-report-finds/", "source": "Block Club Chicago", "published": "2026-06-23T07:00:00+00:00", "wards": [], "aldermen": [], "routes": [], "projects": []}, {"title": "CDOT Planner Riley O'Neil died after being doored in a paint-only bike lane. Chicago, Bike Grid Now! says we must value people over car parking.", "url": "https://chi.streetsblog.org/2026/06/17/complete-streets-planner-riley-oneil-died-in-a-paint-only-bike-lane-protesters-demand-we-value-people-over-parking", "source": "Streetsblog Chicago", "published": "2026-06-17T07:00:00+00:00", "wards": [], "aldermen": [], "routes": [], "projects": []}, {"title": "Tips and Hot Links: Bikers call for change", "url": "https://www.axios.com/local/chicago/2026/06/16/tips-and-hot-links-bikers-call-for-change", "source": "Axios", "published": "2026-06-16T07:00:00+00:00", "wards": [], "aldermen": [], "routes": [], "projects": []}, {"title": "Riley O\u2019Neil\u2019s friend: \u201cI\u2019m grateful I knew him\u201d", "url": "https://chi.streetsblog.org/2026/06/15/riley-oneils-friend-im-grateful-i-knew-him", "source": "Streetsblog Chicago", "published": "2026-06-15T07:00:00+00:00", "wards": [], "aldermen": [], "routes": [], "projects": []}, {"title": "Court records show man who allegedly doored Riley O\u2019Neil on Halsted Street has history of traffic infractions", "url": "https://www.chicagotribune.com/2026/06/15/bridgeport-bike-crash-halsted/", "source": "Chicago Tribune", "published": "2026-06-15T07:00:00+00:00", "wards": [], "aldermen": [], "routes": ["halsted"], "projects": []}, {"title": "Here's Better Streets' heartfelt response to Ald. Lopez's callous tweet about Riley O'Neil. And the alder made a broken-clock statement on another recent bike crash.", "url": "https://chi.streetsblog.org/2026/06/12/heres-better-streets-heartfelt-response-to-ald-lopezs-callous-tweet-about-riley-oneil-and-the-alder-made-a-broken-clock-statement-on-another-recent-bike-crash", "source": "Streetsblog Chicago", "published": "2026-06-12T07:00:00+00:00", "wards": ["15"], "aldermen": ["Lopez, Raymond A."], "routes": [], "projects": []}, {"title": "How can Chicago build safer streets for cyclists and pedestrians?", "url": "https://www.wbez.org/in-the-loop-with-sasha-ann-simons/2026/06/11/how-can-chicago-build-safer-streets-for-cyclists-and-pedestrians", "source": "WBEZ Chicago", "published": "2026-06-11T07:00:00+00:00", "wards": [], "aldermen": [], "routes": [], "projects": []}, {"title": "Bill Gates tells lawmakers meeting Jeffrey Epstein was a \u2018grave error in judgment\u2019 in closed-door hearing", "url": "https://www.chicagotribune.com/2026/06/10/bill-gates-jeffrey-epstein-investigation/", "source": "Chicago Tribune", "published": "2026-06-10T07:00:00+00:00", "wards": [], "aldermen": [], "routes": [], "projects": []}, {"title": "The bike ride and \"die-in\" in memory of fallen Complete Streets Planner Riley O'Neil was a life-affirming event", "url": "https://chi.streetsblog.org/2026/06/09/the-bike-ride-and-die-in-in-memory-of-fallen-complete-streets-planner-riley-oneil-was-a-life-affirming-event", "source": "Streetsblog Chicago", "published": "2026-06-09T07:00:00+00:00", "wards": [], "aldermen": [], "routes": [], "projects": []}, {"title": "Hundreds Join Ride To Honor Cyclist Riley O\u2019Neil \u2014 And Demand Safer Streets: 'People Are Dying'", "url": "https://blockclubchicago.org/2026/06/09/hundreds-ride-through-bridgeport-to-honor-cyclist-riley-oneil-and-demand-safer-streets-people-are-dying/", "source": "Block Club Chicago", "published": "2026-06-09T07:00:00+00:00", "wards": [], "aldermen": [], "routes": [], "projects": []}, {"title": "Riley O\u2019Neil, bicyclist killed in Bridgeport crash, remembered at vigil: \u2018People loved him\u2019", "url": "https://www.chicagotribune.com/2026/06/09/riley-oneil-bridgeport-bike-crash